{
  "$schema": "https://json-schema.org/draft/2020-12/schema",
  "$id": "https://safe-run.local/schemas/event-envelope.schema.json",
  "title": "EventEnvelope",
  "type": "object",
  "required": [
    "schema_version",
    "packet_id",
    "session_id",
    "seq",
    "watch_timestamp",
    "kind",
    "payload"
  ],
  "properties": {
    "schema_version": {
      "type": "integer",
      "const": 1
    },
    "packet_id": {
      "type": "string",
      "format": "uuid"
    },
    "session_id": {
      "type": "string"
    },
    "seq": {
      "type": "integer",
      "minimum": 1
    },
    "watch_timestamp": {
      "type": "string",
      "format": "date-time"
    },
    "kind": {
      "const": "event"
    },
    "payload": {
      "type": "object",
      "required": [
        "event_id",
        "event_type",
        "severity",
        "incident_id"
      ],
      "properties": {
        "event_id": {
          "type": "string",
          "format": "uuid"
        },
        "event_type": {
          "type": "string",
          "enum": [
            "session_started", "session_paused", "session_resumed", "session_ended",
            "check_in_started", "check_in_ok", "check_in_help_requested", "check_in_timeout",
            "manual_sos", "manual_sos_cancelled", "auto_anomaly_triggered",
            "connection_degraded", "state_sync"
          ]
        },
        "severity": {
          "type": "string",
          "enum": [
            "info",
            "warning",
            "critical"
          ]
        },
        "rule_id": {
          "type": [
            "string",
            "null"
          ]
        },
        "incident_id": {
          "type": [
            "string",
            "null"
          ],
          "format": "uuid"
        },
        "context": {
          "type": "object"
        }
      },
      "additionalProperties": true,
      "allOf": [{
        "if": { "properties": { "event_type": { "const": "manual_sos_cancelled" } } },
        "then": {
          "properties": {
            "severity": { "const": "critical" },
            "incident_id": { "type": "string", "format": "uuid" }
          }
        }
      }, {
        "if": { "properties": { "event_type": { "enum": ["check_in_started", "check_in_ok", "check_in_help_requested", "check_in_timeout"] } } },
        "then": {
          "required": ["rule_id"],
          "properties": { "incident_id": { "type": "string", "format": "uuid" }, "rule_id": { "const": "high_hr_sustained_v1" } }
        }
      }, {
        "if": { "properties": { "event_type": { "const": "check_in_started" } } },
        "then": { "properties": { "severity": { "const": "warning" } } }
      }, {
        "if": { "properties": { "event_type": { "const": "check_in_ok" } } },
        "then": { "properties": { "severity": { "const": "info" } } }
      }, {
        "if": { "properties": { "event_type": { "enum": ["check_in_help_requested", "check_in_timeout"] } } },
        "then": { "properties": { "severity": { "const": "critical" } } }
      }]
    }
  },
  "additionalProperties": false
}
